{
  "configuration": {
    "dimension": 256,
    "inputBound": 0.05,
    "inputScenario": "gaussian_bounded",
    "keyframeInterval": 0,
    "pcaComponents": 8,
    "qmax": 127,
    "seed": 101,
    "steps": 200,
    "thresholds": {
      "maximum_invariant_violations": 0,
      "maximum_mean_energy_relative_drift": 0.05,
      "maximum_normalized_rmse": 0.1,
      "minimum_compression_ratio": 4.0,
      "minimum_cosine_similarity": 0.95
    },
    "topK": 16
  },
  "coreArithmeticVersion": "fixed-order-f64-v1",
  "coreRuntimeNanoseconds": 90158375,
  "coreStateDigest": "712009ac3d9fc12ad849e5042544c54c77c672a356c6bea7f9add0c2c5ae3f2b",
  "createdAt": "2026-07-28T21:24:21.500938+00:00",
  "environment": {
    "implementationVersion": "0.3.0",
    "numpy": "2.3.5",
    "platform": "macOS-26.3-arm64-arm-64bit",
    "python": "3.12.13"
  },
  "inputDigest": "bca9b3c30efd4fc22b880fdace497580613b3ff5620ae8256a0c65e41eb14184",
  "invariants": {
    "details": [],
    "deterministicReplay": true,
    "violations": 0
  },
  "methods": [
    {
      "compressionRatio": 1.0,
      "cosineSimilarity": 1.0000000000000002,
      "csiRelativeDrift": 0.0,
      "decodeNanoseconds": 30333,
      "encodeNanoseconds": 7292,
      "energyDriftRelativeDifference": 0.0,
      "fileBytes": 205889,
      "maximumAbsoluteError": 0.0,
      "meanEnergyRelativeDrift": 0.0,
      "metadata": {
        "dtype": "float32",
        "format": "dense-v1",
        "shape": [
          201,
          256
        ]
      },
      "name": "dense",
      "normalizedRMSE": 0.0,
      "payloadBytes": 205824,
      "peakMemoryBytes": 3921512,
      "rmse": 0.0,
      "stepsPerSecond": 2218.3185976426594,
      "trajectoryRMSE": 0.0
    },
    {
      "compressionRatio": 13.153374233128835,
      "cosineSimilarity": 0.9999071745197023,
      "csiRelativeDrift": 0.0015323354064431722,
      "decodeNanoseconds": 72792,
      "encodeNanoseconds": 4946916,
      "energyDriftRelativeDifference": 0.0003972257523552076,
      "fileBytes": 15726,
      "maximumAbsoluteError": 0.054704904556274414,
      "meanEnergyRelativeDrift": 0.0001856600807725079,
      "metadata": {
        "components": 8,
        "dtype": "float32",
        "format": "pca-v1",
        "shape": [
          201,
          256
        ]
      },
      "name": "pca",
      "normalizedRMSE": 0.01362506308336041,
      "payloadBytes": 15648,
      "peakMemoryBytes": 3921512,
      "rmse": 0.008275008435183187,
      "stepsPerSecond": 2218.3185976426594,
      "trajectoryRMSE": 0.008275008435183187
    },
    {
      "compressionRatio": 5.681978798586573,
      "cosineSimilarity": 0.9987302001114037,
      "csiRelativeDrift": 0.004487893639103399,
      "decodeNanoseconds": 48140000,
      "encodeNanoseconds": 85056917,
      "energyDriftRelativeDifference": 0.008836050189506851,
      "fileBytes": 36502,
      "maximumAbsoluteError": 0.13043195009231567,
      "meanEnergyRelativeDrift": 0.025422474407529816,
      "metadata": {
        "canonicalizationVersion": "fixed-order-v1",
        "format": "voidtoken-residual-keyframe-v4",
        "indexBytes": 2,
        "keyframeInterval": 8,
        "keyframePolicy": "automatic-byte-budget",
        "prediction": "decoder-state-error-feedback",
        "qmax": 127,
        "quantizedValueBytes": 1,
        "shape": [
          201,
          256
        ],
        "topK": 16
      },
      "name": "voidtoken",
      "normalizedRMSE": 0.05167952307281226,
      "payloadBytes": 36224,
      "peakMemoryBytes": 3921512,
      "rmse": 0.031386899769736167,
      "stepsPerSecond": 2218.3185976426594,
      "trajectoryRMSE": 0.031386899769736167
    }
  ],
  "runId": "dc791dd4c5c3250a",
  "schemaVersion": "0.3",
  "timeSeries": [
    {
      "csi": 100000000.0,
      "energy": 0.0,
      "energyDrift": 0.0,
      "pcaRMSE": 0.013939265048063223,
      "stateNorm": 0.0,
      "step": 0,
      "voidTokenRMSE": 0.0
    },
    {
      "csi": 80826.88798236092,
      "energy": 0.006345553725213443,
      "energyDrift": 0.006345553725213443,
      "pcaRMSE": 0.012233942815837683,
      "stateNorm": 0.07965898395795319,
      "step": 1,
      "voidTokenRMSE": 0.004330706855254538
    },
    {
      "csi": 37019.167298146596,
      "energy": 0.014433002279325924,
      "energyDrift": 0.00808744855411248,
      "pcaRMSE": 0.011141071184825827,
      "stateNorm": 0.12013743080042091,
      "step": 2,
      "voidTokenRMSE": 0.00599379601975903
    },
    {
      "csi": 24995.651093150173,
      "energy": 0.02030359249293932,
      "energyDrift": 0.005870590213613396,
      "pcaRMSE": 0.009827239595796752,
      "stateNorm": 0.14249067510872182,
      "step": 3,
      "voidTokenRMSE": 0.006474764676088654
    },
    {
      "csi": 17972.173091016946,
      "energy": 0.030400884759678087,
      "energyDrift": 0.010097292266738767,
      "pcaRMSE": 0.00859903290923953,
      "stateNorm": 0.174358494945552,
      "step": 4,
      "voidTokenRMSE": 0.007432875490416724
    },
    {
      "csi": 13626.449649566996,
      "energy": 0.04175647093197045,
      "energyDrift": 0.011355586172292362,
      "pcaRMSE": 0.008190185711141938,
      "stateNorm": 0.20434400145825288,
      "step": 5,
      "voidTokenRMSE": 0.007843265944435204
    },
    {
      "csi": 10747.573716032755,
      "energy": 0.054164374080645186,
      "energyDrift": 0.012407903148674737,
      "pcaRMSE": 0.007872356344167426,
      "stateNorm": 0.23273240874584955,
      "step": 6,
      "voidTokenRMSE": 0.008174576251599015
    },
    {
      "csi": 9029.276482798363,
      "energy": 0.06043966405896895,
      "energyDrift": 0.006275289978323766,
      "pcaRMSE": 0.007340879154944367,
      "stateNorm": 0.24584479668882347,
      "step": 7,
      "voidTokenRMSE": 0.007886784586272656
    },
    {
      "csi": 7836.76830195067,
      "energy": 0.06746153248067796,
      "energyDrift": 0.0070218684217090085,
      "pcaRMSE": 0.006951156039975904,
      "stateNorm": 0.2597335798095386,
      "step": 8,
      "voidTokenRMSE": 0.0
    },
    {
      "csi": 6979.166970993347,
      "energy": 0.07316100607661367,
      "energyDrift": 0.005699473595935714,
      "pcaRMSE": 0.0063035516714015395,
      "stateNorm": 0.27048291272576475,
      "step": 9,
      "voidTokenRMSE": 0.004056063643907892
    },
    {
      "csi": 6293.430688775172,
      "energy": 0.08092043834885392,
      "energyDrift": 0.007759432272240241,
      "pcaRMSE": 0.006577203962700343,
      "stateNorm": 0.28446517950155853,
      "step": 10,
      "voidTokenRMSE": 0.005298985486557861
    },
    {
      "csi": 5713.853013598512,
      "energy": 0.09046991478276784,
      "energyDrift": 0.00954947643391392,
      "pcaRMSE": 0.006939773316637037,
      "stateNorm": 0.3007821716504617,
      "step": 11,
      "voidTokenRMSE": 0.006187056123565617
    },
    {
      "csi": 5215.8517873769215,
      "energy": 0.10074640725219426,
      "energyDrift": 0.010276492469426426,
      "pcaRMSE": 0.007152826176380909,
      "stateNorm": 0.31740574546185246,
      "step": 12,
      "voidTokenRMSE": 0.00658803954152807
    },
    {
      "csi": 4772.629109461375,
      "energy": 0.11310421925744046,
      "energyDrift": 0.012357812005246202,
      "pcaRMSE": 0.007536081128578195,
      "stateNorm": 0.3363097073494021,
      "step": 13,
      "voidTokenRMSE": 0.007515958903248058
    },
    {
      "csi": 4373.610285951375,
      "energy": 0.1273927949635775,
      "energyDrift": 0.014288575706137036,
      "pcaRMSE": 0.008414093041753322,
      "stateNorm": 0.35692127278095587,
      "step": 14,
      "voidTokenRMSE": 0.007995957828559901
    },
    {
      "csi": 4039.2922469698665,
      "energy": 0.13654849301934002,
      "energyDrift": 0.009155698055762523,
      "pcaRMSE": 0.008770637362500977,
      "stateNorm": 0.36952468526384,
      "step": 15,
      "voidTokenRMSE": 0.007532915544303653
    },
    {
      "csi": 3757.023139272419,
      "energy": 0.14478704946393273,
      "energyDrift": 0.008238556444592704,
      "pcaRMSE": 0.008714656076011913,
      "stateNorm": 0.38050893480171094,
      "step": 16,
      "voidTokenRMSE": 0.0
    },
    {
      "csi": 3496.639271001324,
      "energy": 0.16012184800141976,
      "energyDrift": 0.015334798537487038,
      "pcaRMSE": 0.009165924996759434,
      "stateNorm": 0.4001522810148903,
      "step": 17,
      "voidTokenRMSE": 0.00445366991062944
    },
    {
      "csi": 3269.207964543523,
      "energy": 0.1705997756361846,
      "energyDrift": 0.010477927634764822,
      "pcaRMSE": 0.009107825133105964,
      "stateNorm": 0.4130372569589632,
      "step": 18,
      "voidTokenRMSE": 0.005413803567456149
    },
    {
      "csi": 3057.7294266398794,
      "energy": 0.1873154865351035,
      "energyDrift": 0.016715710898918906,
      "pcaRMSE": 0.009617076057898513,
      "stateNorm": 0.4327995916531155,
      "step": 19,
      "voidTokenRMSE": 0.0063259323849606764
    },
    {
      "csi": 2875.53879928363,
      "energy": 0.19571205404305309,
      "energyDrift": 0.008396567507949593,
      "pcaRMSE": 0.009167369433026349,
      "stateNorm": 0.44239355108664624,
      "step": 20,
      "voidTokenRMSE": 0.006743560298182071
    },
    {
      "csi": 2708.6819612484337,
      "energy": 0.20986028562636005,
      "energyDrift": 0.01414823158330697,
      "pcaRMSE": 0.009633291065148271,
      "stateNorm": 0.45810510325291076,
      "step": 21,
      "voidTokenRMSE": 0.0071118085367877235
    },
    {
      "csi": 2558.1346757797705,
      "energy": 0.22261435828342985,
      "energyDrift": 0.012754072657069793,
      "pcaRMSE": 0.009619294131351739,
      "stateNorm": 0.47182026056903265,
      "step": 22,
      "voidTokenRMSE": 0.007664133826936088
    },
    {
      "csi": 2422.6184269511405,
      "energy": 0.23463634923899318,
      "energyDrift": 0.012021990955563333,
      "pcaRMSE": 0.009938275413077386,
      "stateNorm": 0.4843927634048564,
      "step": 23,